{
  "doc_id": "doc_01K6GS8ZKQ7874BG8P83PN0XBX",
  "filename": "Epf-Co.pdf",
  "size_bytes": 7563,
  "sha256": "20aab150a3e3a4842d8788e5721e122529927c70d6103c5d2530c4288876920f",
  "stored_path": "/workspace/FluidRAG/rag-app/storage/uploads/final/doc_01K6GS8ZKQ7874BG8P83PN0XBX/Epf-Co.pdf",
  "job_id": "job_01K6GS8ZRV8K5KZSBQ8DJ7KR9A"
}